{"package_manifests":[{"manifest_version":"dosa-v3-u0-dev-payload-manifest-3","package_manifest_id":"fixture-window-shards","package_version":"U0-dev","path":"packages/fixture/dosa-payload-manifest.json","sha256":"cccccccccccccccccccccccccccccccccccccccccccccccccccccccccccccccc","size_bytes":1,"table_filename":"window_operator_profiles.parquet"}],"parameters_sha256":"68343e046af24a997195eb2583532d3172234b0b9713f2e4296b9b12300bef94","payload_id":"u0-gate-fixture-payload","public_tables":[{"filename":"runs.parquet","record_count":1,"schema_id":"dosa-v3-run-1","storage":{"layout":"single_file","path":"runs.parquet","sha256":"aaaaaaaaaaaaaaaaaaaaaaaaaaaaaaaaaaaaaaaaaaaaaaaaaaaaaaaaaaaaaaaa","size_bytes":1}},{"filename":"replicons.parquet","record_count":1,"schema_id":"dosa-v3-replicon-1","storage":{"layout":"single_file","path":"replicons.parquet","sha256":"bbbbbbbbbbbbbbbbbbbbbbbbbbbbbbbbbbbbbbbbbbbbbbbbbbbbbbbbbbbbbbbb","size_bytes":1}},{"filename":"window_operator_profiles.parquet","record_count":1,"schema_id":"dosa-v3-window-profile-1","storage":{"layout":"package_manifest_partitioned","package_manifest_ids":["fixture-window-shards"],"partitioning":"scale_then_sha256_accession_bucket"}},{"filename":"replicon_operator_summary.parquet","record_count":1,"schema_id":"dosa-v3-summary-1","storage":{"layout":"single_file","path":"replicon_operator_summary.parquet","sha256":"dddddddddddddddddddddddddddddddddddddddddddddddddddddddddddddddd","size_bytes":1}},{"filename":"excluded_records.parquet","record_count":0,"schema_id":"dosa-v3-exclusion-1","storage":{"layout":"single_file","path":"excluded_records.parquet","sha256":"eeeeeeeeeeeeeeeeeeeeeeeeeeeeeeeeeeeeeeeeeeeeeeeeeeeeeeeeeeeeeeee","size_bytes":1}}],"release_state":"blocked_pending_receipts","run_id":"u0-gate-fixture-run","schema_version":"3.0.0","source_manifest_sha256":"e8b843a1143915358362dbaeb017116ecc176d96949ad95a5e67e4b0a59b9929","supporting_artifacts":[]}
