{"package_manifests":[{"manifest_version":"dosa-v3-u0-dev-payload-manifest-3","package_manifest_id":"u0-operational-window-shards","package_version":"U0-dev","path":"package/dosa-payload-manifest.json","sha256":"c9ed7ac643d79f7f8a32ce5f2e239a492afe406e2dc65005802e436cbbf1f000","size_bytes":648,"table_filename":"window_operator_profiles.parquet"}],"parameters_sha256":"2ff05c6f7cf0b2cc145dc2c36a8065bc2b6904201f2e3a118ae051b50e636dc1","payload_id":"u0-operational-fixture-payload","public_tables":[{"filename":"runs.parquet","record_count":1,"schema_id":"dosa-v3-run-1","storage":{"layout":"single_file","path":"runs.parquet","sha256":"aaaaaaaaaaaaaaaaaaaaaaaaaaaaaaaaaaaaaaaaaaaaaaaaaaaaaaaaaaaaaaaa","size_bytes":1}},{"filename":"replicons.parquet","record_count":1,"schema_id":"dosa-v3-replicon-1","storage":{"layout":"single_file","path":"replicons.parquet","sha256":"bbbbbbbbbbbbbbbbbbbbbbbbbbbbbbbbbbbbbbbbbbbbbbbbbbbbbbbbbbbbbbbb","size_bytes":1}},{"filename":"window_operator_profiles.parquet","record_count":1,"schema_id":"dosa-v3-window-profile-1","storage":{"layout":"package_manifest_partitioned","package_manifest_ids":["u0-operational-window-shards"],"partitioning":"scale_then_sha256_accession_bucket"}},{"filename":"replicon_operator_summary.parquet","record_count":1,"schema_id":"dosa-v3-summary-1","storage":{"layout":"single_file","path":"replicon_operator_summary.parquet","sha256":"dddddddddddddddddddddddddddddddddddddddddddddddddddddddddddddddd","size_bytes":1}},{"filename":"excluded_records.parquet","record_count":0,"schema_id":"dosa-v3-exclusion-1","storage":{"layout":"single_file","path":"excluded_records.parquet","sha256":"eeeeeeeeeeeeeeeeeeeeeeeeeeeeeeeeeeeeeeeeeeeeeeeeeeeeeeeeeeeeeeee","size_bytes":1}}],"release_state":"blocked_pending_receipts","run_id":"u0-operational-fixture-run","schema_version":"3.0.0","source_manifest_sha256":"8a377be561617a65b97d59a0d9c44db66aebc2c6abe6a18205181834308868ba","supporting_artifacts":[]}
